{"acceptance_sequence":0,"inbox_hash":"sha256:b4111013a39187297d430a2da344858f550f3f2c866955d85fcaf6534a16c418","raw_request_bytes_base64":"eyJyZWFzb24iOiJ1c2VyIiwicmVxdWVzdF9oYXNoIjoic2hhMjU2OjUyMGU0YTMyYzhkYzhjZTZkMWQxYTI1YTdhZDk2ZmZkMmE5MDgzOWZjMDk3NDkyYmU0Yjc0NTc4MTQ3MTNiNGYiLCJyZXF1ZXN0X2lkIjoiY2FuY2VsX2FhYWFhYWFhYWFhYWFhYWFhYWFhYWFhYWFhIiwicnVuX2hhc2giOiJzaGEyNTY6ZDMzYWFjNDIxY2U3NjAzNjAyZTlhYjViNDk2ZWE2Yzg4ODQ0MDliZDg0YTJmMmJmNTliYjgwYWU2ZmQyMDhhNiIsInNjaGVtYSI6ImNwcy5jYW5jZWxsYXRpb24tcmVxdWVzdCIsInNjaGVtYV92ZXJzaW9uIjoiMS4wLjAifQ==","raw_request_digest":"sha256:70c7b66f4837e902f63548fece5db97ac1b36c10b00157fe0374b21c9f5229f6","request_hash":"sha256:520e4a32c8dc8ce6d1d1a25a7ad96ffd2a90839fc097492be4b7457814713b4f","request_schema_hash":"sha256:44c396d0ba65d708e1f8778f2de6597d94e96613cb477538e776cad1eda22298","run_hash":"sha256:d33aac421ce7603602e9ab5b496ea6c8884409bd84a2f2bf59bb80ae6fd208a6","schema":"cps.cancellation-inbox-record","schema_version":"1.1.0"}